{"schema":{"fields":[{"name":"index","type":"integer"},{"name":"Categor\u00eda","type":"string"},{"name":"M\u00f3dulo","type":"string"},{"name":"Pregunta padre - Espa\u00f1ol","type":"string"},{"name":"Respuesta - Espa\u00f1ol","type":"string"},{"name":"Sistema relacionado","type":"string"},{"name":"Link","type":"string"},{"name":"Responsable","type":"string"},{"name":"Estado","type":"string"},{"name":"text","type":"string"},{"name":"n_tokens","type":"integer"}],"primaryKey":["index"],"pandas_version":"0.20.0"},"data":[{"index":290,"Categor\u00eda":"RRHH","M\u00f3dulo":"Administraci\u00f3n de personal","Pregunta padre - Espa\u00f1ol":"\u00bfC\u00f3mo puedo disfrutar del permiso de lactancia?","Respuesta - Espa\u00f1ol":"Solo debes notificar al HRBP de tu localidad y solicitar y firmar la carta de Periodo de Lactancia, y\/o solicitar a traves de Contacto RH.\nDesde la intranet de Cuervo accede a Ayuda e selecciona Contacto RH e ingresa con tu usuario y contrase\u00f1a de red y selecciona Recursos Humanos.\n\nPulsa sobre el siguiente link para acceder a la intranet.","Sistema relacionado":"ARANDA","Link":"https:\/\/jcintranet.cuervo.com.mx\/web\/intranet-cuervo","Responsable":"Azucena Tello Leyva","Estado":"\u00ba","text":"M\u00f3dulo:Administraci\u00f3n de personal;Categor\u00eda: RRHH;Pregunta\u00bfC\u00f3mo puedo disfrutar del permiso de lactancia?; Respuesta : Solo debes notificar al HRBP de tu localidad y solicitar y firmar la carta de Periodo de Lactancia, y\/o solicitar a traves de Contacto RH. Desde la intranet de Cuervo accede a Ayuda e selecciona Contacto RH e ingresa con tu usuario y contrase\u00f1a de red y selecciona Recursos Humanos. Pulsa sobre el siguiente link para acceder a la intranet.; Sistema relacionado: ARANDA; Link: https:\/\/jcintranet.cuervo.com.mx\/web\/intranet-cuervo; Responsable:Azucena Tello Leyva; Estado: \u00ba","n_tokens":213},{"index":80,"Categor\u00eda":"RRHH","M\u00f3dulo":"PM&GM","Pregunta padre - Espa\u00f1ol":"\u00bfEn qu\u00e9 fecha me informar\u00e1n del resultado de mi evaluaci\u00f3n?","Respuesta - Espa\u00f1ol":"El resultado de la evaluacion es habilitado a los colaboradores en iGrow  las \u00fatlimas dos semanas de febrero. Pulsa sobre el siguiente link para acceder a iGrow.","Sistema relacionado":"iGrow","Link":"https:\/\/performancemanager5.successfactors.eu\/login?company=casacuervo#\/login","Responsable":"Azucena Tello Leyva","Estado":"Ok","text":"M\u00f3dulo:PM&GM;Categor\u00eda: RRHH;Pregunta\u00bfEn qu\u00e9 fecha me informar\u00e1n del resultado de mi evaluaci\u00f3n?; Respuesta : El resultado de la evaluacion es habilitado a los colaboradores en iGrow las \u00fatlimas dos semanas de febrero. Pulsa sobre el siguiente link para acceder a iGrow.; Sistema relacionado: iGrow; Link: https:\/\/performancemanager5.successfactors.eu\/login?company=casacuervo#\/login; Responsable:Azucena Tello Leyva; Estado: Ok","n_tokens":154},{"index":200,"Categor\u00eda":"RRHH","M\u00f3dulo":"Administraci\u00f3n de personal","Pregunta padre - Espa\u00f1ol":"\u00bfC\u00f3mo puedo solicitar un cambio de cuenta bancaria?","Respuesta - Espa\u00f1ol":"Debes de enviar a Contacto RH tu solicitud e informar al HRBP de tu localidad. Debes enviar contrato o estado de cuenta con los siguientes datos: Nombre del banco, nombre del Beneficiario, dato de Cuenta Clabe.\nDesde la intranet de Cuervo accede a Ayuda e selecciona Contacto RH e ingresa con tu usuario y contrase\u00f1a de red y selecciona Recursos Humanos.\n\nPulsa sobre el siguiente link para acceder a la intranet.","Sistema relacionado":"ARANDA","Link":"https:\/\/jcintranet.cuervo.com.mx\/web\/intranet-cuervo","Responsable":"Azucena Tello Leyva","Estado":"Se puede implementar, pero se recomienda mejorar la respuesta en base a los comentarios.","text":"M\u00f3dulo:Administraci\u00f3n de personal;Categor\u00eda: RRHH;Pregunta\u00bfC\u00f3mo puedo solicitar un cambio de cuenta bancaria?; Respuesta : Debes de enviar a Contacto RH tu solicitud e informar al HRBP de tu localidad. Debes enviar contrato o estado de cuenta con los siguientes datos: Nombre del banco, nombre del Beneficiario, dato de Cuenta Clabe. Desde la intranet de Cuervo accede a Ayuda e selecciona Contacto RH e ingresa con tu usuario y contrase\u00f1a de red y selecciona Recursos Humanos. Pulsa sobre el siguiente link para acceder a la intranet.; Sistema relacionado: ARANDA; Link: https:\/\/jcintranet.cuervo.com.mx\/web\/intranet-cuervo; Responsable:Azucena Tello Leyva; Estado: Se puede implementar, pero se recomienda mejorar la respuesta en base a los comentarios.","n_tokens":266},{"index":270,"Categor\u00eda":"RRHH","M\u00f3dulo":"Administraci\u00f3n de personal","Pregunta padre - Espa\u00f1ol":"\u00bfC\u00f3mo puedo disfrutar del permiso de paternidad?","Respuesta - Espa\u00f1ol":"Ingresa a iGrow y en la secci\u00f3n de Actualizaciones Organizativas dar click en la imagen de Solicita Vacaciones y Tiempo Libre. Crear Nueva Solicitud .Seleccionando el tipo de ausencia que requieras. Esta solicitud requiere aprobacion de tu jefe inmediato en sistema.\n\nPulsa sobre el siguiente link para acceder a iGrow.","Sistema relacionado":"iGrow","Link":"https:\/\/performancemanager5.successfactors.eu\/login?company=casacuervo#\/login","Responsable":"Azucena Tello Leyva","Estado":"\u00ba","text":"M\u00f3dulo:Administraci\u00f3n de personal;Categor\u00eda: RRHH;Pregunta\u00bfC\u00f3mo puedo disfrutar del permiso de paternidad?; Respuesta : Ingresa a iGrow y en la secci\u00f3n de Actualizaciones Organizativas dar click en la imagen de Solicita Vacaciones y Tiempo Libre. Crear Nueva Solicitud .Seleccionando el tipo de ausencia que requieras. Esta solicitud requiere aprobacion de tu jefe inmediato en sistema. Pulsa sobre el siguiente link para acceder a iGrow.; Sistema relacionado: iGrow; Link: https:\/\/performancemanager5.successfactors.eu\/login?company=casacuervo#\/login; Responsable:Azucena Tello Leyva; Estado: \u00ba","n_tokens":209},{"index":710,"Categor\u00eda":"ACCESIBILIDAD","M\u00f3dulo":"Accesibilidad SAP","Pregunta padre - Espa\u00f1ol":"Necesito acceso para visualizar \/ modificar un Canal de Ventas de SAP","Respuesta - Espa\u00f1ol":"Para habilitar esta transacci\u00f3n entra al siguiente link  con el usuario PORTALGRC y con la contrase\u00f1a Agrcportal2021+ y solicita el acceso. Te adjuntamos el manual del portal (Incidencias) para tu apoyo en el proceso.","Sistema relacionado":"Portal de solicitud de acceso","Link":"https:\/\/fiori-u.cuervo.com.mx:4311\/sap\/bc\/ui5_ui5\/ui2\/ushell\/shells\/abap\/FioriLaunchpad.html","Responsable":"Salvador Velasco","Estado":"No se puede implementar si no se solucionan los problemas mencionados.","text":"M\u00f3dulo:Accesibilidad SAP;Categor\u00eda: ACCESIBILIDAD;PreguntaNecesito acceso para visualizar \/ modificar un Canal de Ventas de SAP; Respuesta : Para habilitar esta transacci\u00f3n entra al siguiente link con el usuario PORTALGRC y con la contrase\u00f1a Agrcportal2021+ y solicita el acceso. Te adjuntamos el manual del portal (Incidencias) para tu apoyo en el proceso.; Sistema relacionado: Portal de solicitud de acceso; Link: https:\/\/fiori-u.cuervo.com.mx:4311\/sap\/bc\/ui5_ui5\/ui2\/ushell\/shells\/abap\/FioriLaunchpad.html; Responsable:Salvador Velasco; Estado: No se puede implementar si no se solucionan los problemas mencionados.","n_tokens":233},{"index":550,"Categor\u00eda":"ESTRATEGIAS DE LIBERACI\u00d3N","M\u00f3dulo":"Liberaci\u00f3n SAP","Pregunta padre - Espa\u00f1ol":"\u00bfComo crear una solicitud de pago en SAP?","Respuesta - Espa\u00f1ol":"Para crear una solicitud de Pago, recuerda que debes de elegir la clase de documento SP en la transaccion ME21N. Si tienes dudas te invito a ver el tutorial que hemos preparado para ti. ","Sistema relacionado":"\u00ba","Link":"\u00ba","Responsable":"Pedro Alejandro Avila","Estado":"Ok","text":"M\u00f3dulo:Liberaci\u00f3n SAP;Categor\u00eda: ESTRATEGIAS DE LIBERACI\u00d3N;Pregunta\u00bfComo crear una solicitud de pago en SAP?; Respuesta : Para crear una solicitud de Pago, recuerda que debes de elegir la clase de documento SP en la transaccion ME21N. Si tienes dudas te invito a ver el tutorial que hemos preparado para ti. ; Sistema relacionado: \u00ba; Link: \u00ba; Responsable:Pedro Alejandro Avila; Estado: Ok","n_tokens":142},{"index":350,"Categor\u00eda":"RRHH","M\u00f3dulo":"Administraci\u00f3n de personal","Pregunta padre - Espa\u00f1ol":"\u00bfC\u00f3mo puedo solicitar beneficios en base a antig\u00fcedad?","Respuesta - Espa\u00f1ol":"Debes tener contacto con el HRBP de tu localidad para tener mayor informacion y\/o debes levantar un ticket en Contacto RH para solicitar informacion.\nDesde la intranet de Cuervo accede a Ayuda e selecciona Contacto RH e ingresa con tu usuario y contrase\u00f1a de red y selecciona Recursos Humanos.\n\nPulsa sobre el siguiente link para acceder a la intranet.","Sistema relacionado":"ARANDA","Link":"https:\/\/jcintranet.cuervo.com.mx\/web\/intranet-cuervo","Responsable":"Azucena Tello Leyva","Estado":"\u00ba","text":"M\u00f3dulo:Administraci\u00f3n de personal;Categor\u00eda: RRHH;Pregunta\u00bfC\u00f3mo puedo solicitar beneficios en base a antig\u00fcedad?; Respuesta : Debes tener contacto con el HRBP de tu localidad para tener mayor informacion y\/o debes levantar un ticket en Contacto RH para solicitar informacion. Desde la intranet de Cuervo accede a Ayuda e selecciona Contacto RH e ingresa con tu usuario y contrase\u00f1a de red y selecciona Recursos Humanos. Pulsa sobre el siguiente link para acceder a la intranet.; Sistema relacionado: ARANDA; Link: https:\/\/jcintranet.cuervo.com.mx\/web\/intranet-cuervo; Responsable:Azucena Tello Leyva; Estado: \u00ba","n_tokens":210},{"index":660,"Categor\u00eda":"ACCESIBILIDAD","M\u00f3dulo":"Accesibilidad SAP","Pregunta padre - Espa\u00f1ol":"Necesito acceso para visualizar \/ modificar los datos de un nivel organizativo\n","Respuesta - Espa\u00f1ol":"Para habilitar esta transacci\u00f3n entra al siguiente link con el usuario PORTALGRC y con la contrase\u00f1a Agrcportal2021+ y solicita el acceso. Te adjuntamos el manual del portal (Incidencias) para tu apoyo en el proceso.","Sistema relacionado":"Portal de solicitud de acceso","Link":"https:\/\/fiori-u.cuervo.com.mx:4311\/sap\/bc\/ui5_ui5\/ui2\/ushell\/shells\/abap\/FioriLaunchpad.html","Responsable":"Salvador Velasco","Estado":"No se puede implementar si no se solucionan los problemas mencionados.","text":"M\u00f3dulo:Accesibilidad SAP;Categor\u00eda: ACCESIBILIDAD;PreguntaNecesito acceso para visualizar \/ modificar los datos de un nivel organizativo ; Respuesta : Para habilitar esta transacci\u00f3n entra al siguiente link con el usuario PORTALGRC y con la contrase\u00f1a Agrcportal2021+ y solicita el acceso. Te adjuntamos el manual del portal (Incidencias) para tu apoyo en el proceso.; Sistema relacionado: Portal de solicitud de acceso; Link: https:\/\/fiori-u.cuervo.com.mx:4311\/sap\/bc\/ui5_ui5\/ui2\/ushell\/shells\/abap\/FioriLaunchpad.html; Responsable:Salvador Velasco; Estado: No se puede implementar si no se solucionan los problemas mencionados.","n_tokens":238},{"index":70,"Categor\u00eda":"RRHH","M\u00f3dulo":"PM&GM","Pregunta padre - Espa\u00f1ol":"\u00bfQui\u00e9n realiza mi evaluaci\u00f3n de objetivos?","Respuesta - Espa\u00f1ol":"La evaluaci\u00f3n de desempe\u00f1o consta de dos pasos: \n\n1- Una autoevaluaci\u00f3n, en la cual el colaborador puede calificar su propio desempe\u00f1o (objetivos) y comportamientos.\n\n2- Una evaluaci\u00f3n por parte del jefe directo, en donde el jefe califica los objetivos y comportamientos.","Sistema relacionado":"iGrow","Link":"\u00ba","Responsable":"Azucena Tello Leyva","Estado":"Ok","text":"M\u00f3dulo:PM&GM;Categor\u00eda: RRHH;Pregunta\u00bfQui\u00e9n realiza mi evaluaci\u00f3n de objetivos?; Respuesta : La evaluaci\u00f3n de desempe\u00f1o consta de dos pasos: 1- Una autoevaluaci\u00f3n, en la cual el colaborador puede calificar su propio desempe\u00f1o (objetivos) y comportamientos. 2- Una evaluaci\u00f3n por parte del jefe directo, en donde el jefe califica los objetivos y comportamientos.; Sistema relacionado: iGrow; Link: \u00ba; Responsable:Azucena Tello Leyva; Estado: Ok","n_tokens":172},{"index":530,"Categor\u00eda":"ESTRATEGIAS DE LIBERACI\u00d3N","M\u00f3dulo":"Liberaci\u00f3n SAP","Pregunta padre - Espa\u00f1ol":"Quiero modificar una estrategia de liberaci\u00f3n, \u00bfc\u00f3mo lo hago?","Respuesta - Espa\u00f1ol":"Para solicitar la creaci\u00f3n de una estrategia de liberaci\u00f3n es necesario contar con los siguiente: \na) VoBo del \u00e1rea de redise\u00f1o de proceso o Finanzas.  Se solicita al \u00e1rea de redise\u00f1o la matriz de aprobaci\u00f3n con los montos de cada uno de los aprobadores.\nb) Una vez que tenemos esto. Se deber\u00e1 de abrir un ticket al correo ITSUPPORT@cuervo.com adjuntando las matrices de aprobaci\u00f3n y el VoBo del \u00e1rea de Redise\u00f1\u00f3. ","Sistema relacionado":"\u00ba","Link":"\u00ba","Responsable":"Pedro Alejandro Avila","Estado":"Ok","text":"M\u00f3dulo:Liberaci\u00f3n SAP;Categor\u00eda: ESTRATEGIAS DE LIBERACI\u00d3N;PreguntaQuiero modificar una estrategia de liberaci\u00f3n, \u00bfc\u00f3mo lo hago?; Respuesta : Para solicitar la creaci\u00f3n de una estrategia de liberaci\u00f3n es necesario contar con los siguiente: a) VoBo del \u00e1rea de redise\u00f1o de proceso o Finanzas. Se solicita al \u00e1rea de redise\u00f1o la matriz de aprobaci\u00f3n con los montos de cada uno de los aprobadores. b) Una vez que tenemos esto. Se deber\u00e1 de abrir un ticket al correo ITSUPPORT@cuervo.com adjuntando las matrices de aprobaci\u00f3n y el VoBo del \u00e1rea de Redise\u00f1\u00f3. ; Sistema relacionado: \u00ba; Link: \u00ba; Responsable:Pedro Alejandro Avila; Estado: Ok","n_tokens":243},{"index":330,"Categor\u00eda":"RRHH","M\u00f3dulo":"Administraci\u00f3n de personal","Pregunta padre - Espa\u00f1ol":"\u00bfC\u00f3mo puedo solicitar un beneficio social?","Respuesta - Espa\u00f1ol":"Debes levantar un ticket en Contacto RH para solicitar informacion.\nDesde la intranet de Cuervo accede a Ayuda e selecciona Contacto RH e ingresa con tu usuario y contrase\u00f1a de red y selecciona Recursos Humanos.\n\nPulsa sobre el siguiente link para acceder a la intranet.","Sistema relacionado":"ARANDA","Link":"https:\/\/jcintranet.cuervo.com.mx\/web\/intranet-cuervo","Responsable":"Azucena Tello Leyva","Estado":"\u00ba","text":"M\u00f3dulo:Administraci\u00f3n de personal;Categor\u00eda: RRHH;Pregunta\u00bfC\u00f3mo puedo solicitar un beneficio social?; Respuesta : Debes levantar un ticket en Contacto RH para solicitar informacion. Desde la intranet de Cuervo accede a Ayuda e selecciona Contacto RH e ingresa con tu usuario y contrase\u00f1a de red y selecciona Recursos Humanos. Pulsa sobre el siguiente link para acceder a la intranet.; Sistema relacionado: ARANDA; Link: https:\/\/jcintranet.cuervo.com.mx\/web\/intranet-cuervo; Responsable:Azucena Tello Leyva; Estado: \u00ba","n_tokens":181},{"index":320,"Categor\u00eda":"RRHH","M\u00f3dulo":"Administraci\u00f3n de personal","Pregunta padre - Espa\u00f1ol":"\u00bfC\u00f3mo puedo consultar mis beneficios sociales?","Respuesta - Espa\u00f1ol":"Debes levantar un ticket en Contacto RH para solicitar informacion.\nDesde la intranet de Cuervo accede a Ayuda e selecciona Contacto RH e ingresa con tu usuario y contrase\u00f1a de red y selecciona Recursos Humanos.\n\nPulsa sobre el siguiente link para acceder a la intranet.","Sistema relacionado":"ARANDA","Link":"https:\/\/jcintranet.cuervo.com.mx\/web\/intranet-cuervo","Responsable":"Azucena Tello Leyva","Estado":"\u00ba","text":"M\u00f3dulo:Administraci\u00f3n de personal;Categor\u00eda: RRHH;Pregunta\u00bfC\u00f3mo puedo consultar mis beneficios sociales?; Respuesta : Debes levantar un ticket en Contacto RH para solicitar informacion. Desde la intranet de Cuervo accede a Ayuda e selecciona Contacto RH e ingresa con tu usuario y contrase\u00f1a de red y selecciona Recursos Humanos. Pulsa sobre el siguiente link para acceder a la intranet.; Sistema relacionado: ARANDA; Link: https:\/\/jcintranet.cuervo.com.mx\/web\/intranet-cuervo; Responsable:Azucena Tello Leyva; Estado: \u00ba","n_tokens":182},{"index":130,"Categor\u00eda":"RRHH","M\u00f3dulo":"Administraci\u00f3n de personal","Pregunta padre - Espa\u00f1ol":"\u00bfQue tipo de ausencias puedo solicitar?","Respuesta - Espa\u00f1ol":"Puedes solicitar vacaciones y permisos, que deberan contar con la autorizacion de jefe inmediato. Ingresa a iGrow y en la secci\u00f3n de Actualizaciones Organizativas dar click en la imagen de Solicita Vacaciones y Tiempo Libre.\n\nPulsa sobre el siguiente link para acceder a iGrow.","Sistema relacionado":"iGrow","Link":"https:\/\/performancemanager5.successfactors.eu\/login?company=casacuervo#\/login","Responsable":"Azucena Tello Leyva","Estado":"No se puede implementar si no se solucionan los problemas mencionados.","text":"M\u00f3dulo:Administraci\u00f3n de personal;Categor\u00eda: RRHH;Pregunta\u00bfQue tipo de ausencias puedo solicitar?; Respuesta : Puedes solicitar vacaciones y permisos, que deberan contar con la autorizacion de jefe inmediato. Ingresa a iGrow y en la secci\u00f3n de Actualizaciones Organizativas dar click en la imagen de Solicita Vacaciones y Tiempo Libre. Pulsa sobre el siguiente link para acceder a iGrow.; Sistema relacionado: iGrow; Link: https:\/\/performancemanager5.successfactors.eu\/login?company=casacuervo#\/login; Responsable:Azucena Tello Leyva; Estado: No se puede implementar si no se solucionan los problemas mencionados.","n_tokens":210},{"index":50,"Categor\u00eda":"RRHH","M\u00f3dulo":"PM&GM","Pregunta padre - Espa\u00f1ol":"\u00bfQu\u00e9 criterios se deben cumplir para ser candidato de evaluaci\u00f3n?","Respuesta - Espa\u00f1ol":"Para poder ser evaluado, el colaborador debe tener por lo menos 90 d\u00edas en la posici\u00f3n y estar contratado directamente por Cuervo.","Sistema relacionado":"iGrow","Link":"\u00ba","Responsable":"Azucena Tello Leyva","Estado":"Ok","text":"M\u00f3dulo:PM&GM;Categor\u00eda: RRHH;Pregunta\u00bfQu\u00e9 criterios se deben cumplir para ser candidato de evaluaci\u00f3n?; Respuesta : Para poder ser evaluado, el colaborador debe tener por lo menos 90 d\u00edas en la posici\u00f3n y estar contratado directamente por Cuervo.; Sistema relacionado: iGrow; Link: \u00ba; Responsable:Azucena Tello Leyva; Estado: Ok","n_tokens":122},{"index":650,"Categor\u00eda":"ACCESIBILIDAD","M\u00f3dulo":"Accesibilidad SAP","Pregunta padre - Espa\u00f1ol":"Necesito temporalmente transacciones","Respuesta - Espa\u00f1ol":"Accede al siguiente link  con el usuario PORTALGRC y con la contrase\u00f1a Agrcportal2021+ y solicita el acceso en la secci\u00f3n de TX Adicional \/Vacaciones e\u2026 . (Vacaciones Incapacidad \/ Transacci\u00f3n Adicional)","Sistema relacionado":"Portal de solicitud de acceso","Link":"https:\/\/fiori-u.cuervo.com.mx:4311\/sap\/bc\/ui5_ui5\/ui2\/ushell\/shells\/abap\/FioriLaunchpad.html","Responsable":"Salvador Velasco","Estado":"No se puede implementar si no se solucionan los problemas mencionados.","text":"M\u00f3dulo:Accesibilidad SAP;Categor\u00eda: ACCESIBILIDAD;PreguntaNecesito temporalmente transacciones; Respuesta : Accede al siguiente link con el usuario PORTALGRC y con la contrase\u00f1a Agrcportal2021+ y solicita el acceso en la secci\u00f3n de TX Adicional \/Vacaciones e\u2026 . (Vacaciones Incapacidad \/ Transacci\u00f3n Adicional); Sistema relacionado: Portal de solicitud de acceso; Link: https:\/\/fiori-u.cuervo.com.mx:4311\/sap\/bc\/ui5_ui5\/ui2\/ushell\/shells\/abap\/FioriLaunchpad.html; Responsable:Salvador Velasco; Estado: No se puede implementar si no se solucionan los problemas mencionados.","n_tokens":219},{"index":720,"Categor\u00eda":"ACCESIBILIDAD","M\u00f3dulo":"Accesibilidad SAP","Pregunta padre - Espa\u00f1ol":"Necesito acceso para visualziar \/modificar una Organizaci\u00f3n de Compras de SAP","Respuesta - Espa\u00f1ol":"Para habilitar esta transacci\u00f3n entra al siguiente link con el usuario PORTALGRC y con la contrase\u00f1a Agrcportal2021+ y solicita el acceso. Te adjuntamos el manual del portal (Incidencias) para tu apoyo en el proceso.","Sistema relacionado":"Portal de solicitud de acceso","Link":"https:\/\/fiori-u.cuervo.com.mx:4311\/sap\/bc\/ui5_ui5\/ui2\/ushell\/shells\/abap\/FioriLaunchpad.html","Responsable":"Salvador Velasco","Estado":"No se puede implementar si no se solucionan los problemas mencionados.","text":"M\u00f3dulo:Accesibilidad SAP;Categor\u00eda: ACCESIBILIDAD;PreguntaNecesito acceso para visualziar \/modificar una Organizaci\u00f3n de Compras de SAP; Respuesta : Para habilitar esta transacci\u00f3n entra al siguiente link con el usuario PORTALGRC y con la contrase\u00f1a Agrcportal2021+ y solicita el acceso. Te adjuntamos el manual del portal (Incidencias) para tu apoyo en el proceso.; Sistema relacionado: Portal de solicitud de acceso; Link: https:\/\/fiori-u.cuervo.com.mx:4311\/sap\/bc\/ui5_ui5\/ui2\/ushell\/shells\/abap\/FioriLaunchpad.html; Responsable:Salvador Velasco; Estado: No se puede implementar si no se solucionan los problemas mencionados.","n_tokens":238},{"index":500,"Categor\u00eda":"ESTRATEGIAS DE LIBERACI\u00d3N","M\u00f3dulo":"Liberaci\u00f3n SAP","Pregunta padre - Espa\u00f1ol":"C\u00f3mo puedo consultar que estrategias de liberacion","Respuesta - Espa\u00f1ol":"Puedes entrar a la transacci\u00f3n ZMMR120.\nAgregar el grupo de Liberac\u00edon: \nAG-Release PR AG\nJC-Release PR Cuervo\nOP-Operation Release SP\nPA-Release PR PAU\nUS-Release P.Orders USA\nZ1-ReleaseStrategicProx\nZ2-Liberaci\u00f3n ABA0\nZ4-Liberaci\u00f3n OBD\nZA-Agric. Release SP\nZC-Liberaci\u00f3nes Coorporativo\nZD-Payment Request DEU\nZE-Liberaci\u00f3n ICON\nZI-Release PO JCMD\nZJ-Liberaciones JB\nZO-Release PR Operation\nZP-Release PO PUK\nSeleccionar si es para una Requisicion de compra o Solicitud de pago en el campo Objeto de Liberaci\u00f3n.","Sistema relacionado":"SAP ECC","Link":"\u00ba","Responsable":"Pedro Alejandro Avila","Estado":"Ok","text":"M\u00f3dulo:Liberaci\u00f3n SAP;Categor\u00eda: ESTRATEGIAS DE LIBERACI\u00d3N;PreguntaC\u00f3mo puedo consultar que estrategias de liberacion; Respuesta : Puedes entrar a la transacci\u00f3n ZMMR120. Agregar el grupo de Liberac\u00edon: AG-Release PR AG JC-Release PR Cuervo OP-Operation Release SP PA-Release PR PAU US-Release P.Orders USA Z1-ReleaseStrategicProx Z2-Liberaci\u00f3n ABA0 Z4-Liberaci\u00f3n OBD ZA-Agric. Release SP ZC-Liberaci\u00f3nes Coorporativo ZD-Payment Request DEU ZE-Liberaci\u00f3n ICON ZI-Release PO JCMD ZJ-Liberaciones JB ZO-Release PR Operation ZP-Release PO PUK Seleccionar si es para una Requisicion de compra o Solicitud de pago en el campo Objeto de Liberaci\u00f3n.; Sistema relacionado: SAP ECC; Link: \u00ba; Responsable:Pedro Alejandro Avila; Estado: Ok","n_tokens":263},{"index":730,"Categor\u00eda":"ACCESIBILIDAD","M\u00f3dulo":"Accesibilidad SAP","Pregunta padre - Espa\u00f1ol":"Necesito solicitar un Fire Figther","Respuesta - Espa\u00f1ol":"Para habilitar el Fire Figther acceder al siguiente link con tu usuario y contrase\u00f1a de FIORI con el que cuenta el usuario habilitado. ( Solicitud de Fire Fighter)","Sistema relacionado":"GRC","Link":"https:\/\/fiori-u.cuervo.com.mx:4311\/sap\/bc\/ui5_ui5\/ui2\/ushell\/shells\/abap\/FioriLaunchpad.html","Responsable":"Salvador Velasco","Estado":"No se puede implementar si no se solucionan los problemas mencionados.","text":"M\u00f3dulo:Accesibilidad SAP;Categor\u00eda: ACCESIBILIDAD;PreguntaNecesito solicitar un Fire Figther; Respuesta : Para habilitar el Fire Figther acceder al siguiente link con tu usuario y contrase\u00f1a de FIORI con el que cuenta el usuario habilitado. ( Solicitud de Fire Fighter); Sistema relacionado: GRC; Link: https:\/\/fiori-u.cuervo.com.mx:4311\/sap\/bc\/ui5_ui5\/ui2\/ushell\/shells\/abap\/FioriLaunchpad.html; Responsable:Salvador Velasco; Estado: No se puede implementar si no se solucionan los problemas mencionados.","n_tokens":191},{"index":40,"Categor\u00eda":"RRHH","M\u00f3dulo":"PM&GM","Pregunta padre - Espa\u00f1ol":"\u00bfQu\u00e9 antig\u00fcedad debo tener para optar a la evaluaci\u00f3n anual?","Respuesta - Espa\u00f1ol":"Para poder ser evaluado, el colaborador debe tener por lo menos 90 d\u00edas en la posici\u00f3n..","Sistema relacionado":"iGrow","Link":"\u00ba","Responsable":"Azucena Tello Leyva","Estado":"Ok","text":"M\u00f3dulo:PM&GM;Categor\u00eda: RRHH;Pregunta\u00bfQu\u00e9 antig\u00fcedad debo tener para optar a la evaluaci\u00f3n anual?; Respuesta : Para poder ser evaluado, el colaborador debe tener por lo menos 90 d\u00edas en la posici\u00f3n..; Sistema relacionado: iGrow; Link: \u00ba; Responsable:Azucena Tello Leyva; Estado: Ok","n_tokens":112},{"index":700,"Categor\u00eda":"ACCESIBILIDAD","M\u00f3dulo":"Accesibilidad SAP","Pregunta padre - Espa\u00f1ol":"Necesito acceso para visualizar \/ modificar una Organizaci\u00f3n de Ventas de SAP","Respuesta - Espa\u00f1ol":"Para habilitar esta transacci\u00f3n entra al siguiente link  con el usuario PORTALGRC y con la contrase\u00f1a Agrcportal2021+ y solicita el acceso. Te adjuntamos el manual del portal (Incidencias) para tu apoyo en el proceso.","Sistema relacionado":"Portal de solicitud de acceso","Link":"https:\/\/fiori-u.cuervo.com.mx:4311\/sap\/bc\/ui5_ui5\/ui2\/ushell\/shells\/abap\/FioriLaunchpad.html","Responsable":"Salvador Velasco","Estado":"\u00ba","text":"M\u00f3dulo:Accesibilidad SAP;Categor\u00eda: ACCESIBILIDAD;PreguntaNecesito acceso para visualizar \/ modificar una Organizaci\u00f3n de Ventas de SAP; Respuesta : Para habilitar esta transacci\u00f3n entra al siguiente link con el usuario PORTALGRC y con la contrase\u00f1a Agrcportal2021+ y solicita el acceso. Te adjuntamos el manual del portal (Incidencias) para tu apoyo en el proceso.; Sistema relacionado: Portal de solicitud de acceso; Link: https:\/\/fiori-u.cuervo.com.mx:4311\/sap\/bc\/ui5_ui5\/ui2\/ushell\/shells\/abap\/FioriLaunchpad.html; Responsable:Salvador Velasco; Estado: \u00ba","n_tokens":217},{"index":540,"Categor\u00eda":"ESTRATEGIAS DE LIBERACI\u00d3N","M\u00f3dulo":"Liberaci\u00f3n SAP","Pregunta padre - Espa\u00f1ol":"Los que aprueban son incorrectos. \u00bfPueden corregirlo?","Respuesta - Espa\u00f1ol":"a) Se necesita conocer cu\u00e1l es el grupo de compras que queremos actualizar. \nb) Debemos de solicitar la validaci\u00f3n de la matriz de aprobadores al \u00c1rea de Redise\u00f1o de proceso o Finanzas\nc) Con el VoBo de estas \u00c1reas de procesos abrimos un ticket adjuntando la nueva matriz de aprobaci\u00f3n y sus montos al correo ITSUPPORT@cuervo.com","Sistema relacionado":"\u00ba","Link":"\u00ba","Responsable":"Pedro Alejandro Avila","Estado":"Ok","text":"M\u00f3dulo:Liberaci\u00f3n SAP;Categor\u00eda: ESTRATEGIAS DE LIBERACI\u00d3N;PreguntaLos que aprueban son incorrectos. \u00bfPueden corregirlo?; Respuesta : a) Se necesita conocer cu\u00e1l es el grupo de compras que queremos actualizar. b) Debemos de solicitar la validaci\u00f3n de la matriz de aprobadores al \u00c1rea de Redise\u00f1o de proceso o Finanzas c) Con el VoBo de estas \u00c1reas de procesos abrimos un ticket adjuntando la nueva matriz de aprobaci\u00f3n y sus montos al correo ITSUPPORT@cuervo.com; Sistema relacionado: \u00ba; Link: \u00ba; Responsable:Pedro Alejandro Avila; Estado: Ok","n_tokens":204},{"index":430,"Categor\u00eda":"RRHH","M\u00f3dulo":"Administraci\u00f3n de personal","Pregunta padre - Espa\u00f1ol":"\u00bfComo puedo solicitar constancias laborales \/ antig\u00fcedad, de ingesos?","Respuesta - Espa\u00f1ol":"Debes levantar un ticket en Contacto RH para solicitar informacion.\nDesde la intranet de Cuervo accede a Ayuda e selecciona Contacto RH e ingresa con tu usuario y contrase\u00f1a de red y selecciona Recursos Humanos.\n\nPulsa sobre el siguiente link para acceder a la intranet.","Sistema relacionado":"ARANDA","Link":"https:\/\/jcintranet.cuervo.com.mx\/web\/intranet-cuervo","Responsable":"Azucena Tello Leyva","Estado":"\u00ba","text":"M\u00f3dulo:Administraci\u00f3n de personal;Categor\u00eda: RRHH;Pregunta\u00bfComo puedo solicitar constancias laborales \/ antig\u00fcedad, de ingesos?; Respuesta : Debes levantar un ticket en Contacto RH para solicitar informacion. Desde la intranet de Cuervo accede a Ayuda e selecciona Contacto RH e ingresa con tu usuario y contrase\u00f1a de red y selecciona Recursos Humanos. Pulsa sobre el siguiente link para acceder a la intranet.; Sistema relacionado: ARANDA; Link: https:\/\/jcintranet.cuervo.com.mx\/web\/intranet-cuervo; Responsable:Azucena Tello Leyva; Estado: \u00ba","n_tokens":193},{"index":110,"Categor\u00eda":"RRHH","M\u00f3dulo":"PM&GM","Pregunta padre - Espa\u00f1ol":"\u00bfCu\u00e1ntos d\u00edas de vacaciones me pertenecen?","Respuesta - Espa\u00f1ol":"Puedes visualizar tu saldo de vacaciones en opci\u00f3n de Solicita Vacaciones y Tiempo Libre.\n\nPulsa sobre el siguiente link para acceder a iGrow.","Sistema relacionado":"iGrow","Link":"https:\/\/performancemanager5.successfactors.eu\/login?company=casacuervo#\/login","Responsable":"Azucena Tello Leyva","Estado":"Se puede implementar, pero se recomienda mejorar la respuesta en base a los comentarios.","text":"M\u00f3dulo:PM&GM;Categor\u00eda: RRHH;Pregunta\u00bfCu\u00e1ntos d\u00edas de vacaciones me pertenecen?; Respuesta : Puedes visualizar tu saldo de vacaciones en opci\u00f3n de Solicita Vacaciones y Tiempo Libre. Pulsa sobre el siguiente link para acceder a iGrow.; Sistema relacionado: iGrow; Link: https:\/\/performancemanager5.successfactors.eu\/login?company=casacuervo#\/login; Responsable:Azucena Tello Leyva; Estado: Se puede implementar, pero se recomienda mejorar la respuesta en base a los comentarios.","n_tokens":173},{"index":640,"Categor\u00eda":"ACCESIBILIDAD","M\u00f3dulo":"Accesibilidad SAP","Pregunta padre - Espa\u00f1ol":"Necesito sustuir a un compa\u00f1ero.","Respuesta - Espa\u00f1ol":"Accede al siguiente link  con el usuario PORTALGRC y con la contrase\u00f1a Agrcportal2021+ y solicita el acceso en la secci\u00f3n de TX Adicional \/Vacaciones e\u2026 . (Vacaciones Incapacidad \/ Transacci\u00f3n Adicional)","Sistema relacionado":"Portal de solicitud de acceso","Link":"https:\/\/fiori-u.cuervo.com.mx:4311\/sap\/bc\/ui5_ui5\/ui2\/ushell\/shells\/abap\/FioriLaunchpad.html","Responsable":"Salvador Velasco","Estado":"No se puede implementar si no se solucionan los problemas mencionados.","text":"M\u00f3dulo:Accesibilidad SAP;Categor\u00eda: ACCESIBILIDAD;PreguntaNecesito sustuir a un compa\u00f1ero.; Respuesta : Accede al siguiente link con el usuario PORTALGRC y con la contrase\u00f1a Agrcportal2021+ y solicita el acceso en la secci\u00f3n de TX Adicional \/Vacaciones e\u2026 . (Vacaciones Incapacidad \/ Transacci\u00f3n Adicional); Sistema relacionado: Portal de solicitud de acceso; Link: https:\/\/fiori-u.cuervo.com.mx:4311\/sap\/bc\/ui5_ui5\/ui2\/ushell\/shells\/abap\/FioriLaunchpad.html; Responsable:Salvador Velasco; Estado: No se puede implementar si no se solucionan los problemas mencionados.","n_tokens":221},{"index":90,"Categor\u00eda":"RRHH","M\u00f3dulo":"PM&GM","Pregunta padre - Espa\u00f1ol":"\u00bfC\u00f3mo puedo conocer el resultado de mi evaluaci\u00f3n?","Respuesta - Espa\u00f1ol":"Cada colaborador puede consultar sus resultados desde la pesta\u00f1a de \"Desempe\u00f1o\" en iGrow. Una vez seleccionada la opci\u00f3n, el colaborador debe buscar el formulario de talento correspondiente al a\u00f1o que desea consultar. \n\nDe igual manera, es responsabilidad del jefe directo compartir esta calificaci\u00f3n con los miembros de su equipo.\n\nPulsa sobre el siguiente link para acceder a iGrow.","Sistema relacionado":"iGrow","Link":"https:\/\/performancemanager5.successfactors.eu\/login?company=casacuervo#\/login","Responsable":"Azucena Tello Leyva","Estado":"Se puede implementar, pero se recomienda mejorar la respuesta en base a los comentarios.","text":"M\u00f3dulo:PM&GM;Categor\u00eda: RRHH;Pregunta\u00bfC\u00f3mo puedo conocer el resultado de mi evaluaci\u00f3n?; Respuesta : Cada colaborador puede consultar sus resultados desde la pesta\u00f1a de \"Desempe\u00f1o\" en iGrow. Una vez seleccionada la opci\u00f3n, el colaborador debe buscar el formulario de talento correspondiente al a\u00f1o que desea consultar. De igual manera, es responsabilidad del jefe directo compartir esta calificaci\u00f3n con los miembros de su equipo. Pulsa sobre el siguiente link para acceder a iGrow.; Sistema relacionado: iGrow; Link: https:\/\/performancemanager5.successfactors.eu\/login?company=casacuervo#\/login; Responsable:Azucena Tello Leyva; Estado: Se puede implementar, pero se recomienda mejorar la respuesta en base a los comentarios.","n_tokens":251},{"index":580,"Categor\u00eda":"ESTRATEGIAS DE LIBERACI\u00d3N","M\u00f3dulo":"Liberaci\u00f3n SAP","Pregunta padre - Espa\u00f1ol":"\u00bfC\u00f3mo se adjuntan archivos en una solicitud de pago?","Respuesta - Espa\u00f1ol":"Recuerda que en las Solicitudes de Pago es necesario adjuntar los documentos de tipo Factura, Cotizaciones. En caso de dudas de como hacerlo. Si tienes dudas te invito a ver el tutorial que hemos preparado para ti. ","Sistema relacionado":"\u00ba","Link":"\u00ba","Responsable":"Pedro Alejandro Avila","Estado":"Ok","text":"M\u00f3dulo:Liberaci\u00f3n SAP;Categor\u00eda: ESTRATEGIAS DE LIBERACI\u00d3N;Pregunta\u00bfC\u00f3mo se adjuntan archivos en una solicitud de pago?; Respuesta : Recuerda que en las Solicitudes de Pago es necesario adjuntar los documentos de tipo Factura, Cotizaciones. En caso de dudas de como hacerlo. Si tienes dudas te invito a ver el tutorial que hemos preparado para ti. ; Sistema relacionado: \u00ba; Link: \u00ba; Responsable:Pedro Alejandro Avila; Estado: Ok","n_tokens":157},{"index":60,"Categor\u00eda":"RRHH","M\u00f3dulo":"PM&GM","Pregunta padre - Espa\u00f1ol":"\u00bfQu\u00e9 se eval\u00faa en el proceso de evaluaci\u00f3n de objetivos?","Respuesta - Espa\u00f1ol":"Se eval\u00faan los objetivos y comportamientos que el propio colaborador define en conjunto con su jefe. Tanto los objetivos como los comportamientos deben estar alineados con la funci\u00f3n de cada colaborador y los objetivos del negocio.","Sistema relacionado":"iGrow","Link":"\u00ba","Responsable":"Azucena Tello Leyva","Estado":"Ok","text":"M\u00f3dulo:PM&GM;Categor\u00eda: RRHH;Pregunta\u00bfQu\u00e9 se eval\u00faa en el proceso de evaluaci\u00f3n de objetivos?; Respuesta : Se eval\u00faan los objetivos y comportamientos que el propio colaborador define en conjunto con su jefe. Tanto los objetivos como los comportamientos deben estar alineados con la funci\u00f3n de cada colaborador y los objetivos del negocio.; Sistema relacionado: iGrow; Link: \u00ba; Responsable:Azucena Tello Leyva; Estado: Ok","n_tokens":155},{"index":180,"Categor\u00eda":"RRHH","M\u00f3dulo":"Administraci\u00f3n de personal","Pregunta padre - Espa\u00f1ol":"\u00bfC\u00f3mo puedo solicitar d\u00edas de permiso?","Respuesta - Espa\u00f1ol":"Ingresa a iGrow y en la secci\u00f3n de Actualizaciones Organizativas dar click en la imagen de Solicita Vacaciones y Tiempo Libre. Crear Nueva Solicitud . Esta solicitud requiere aprobacion de tu jefe inmediato en sistema.\n\nPulsa sobre el siguiente link para acceder a iGrow.","Sistema relacionado":"iGrow","Link":"https:\/\/performancemanager5.successfactors.eu\/login?company=casacuervo#\/login","Responsable":"Azucena Tello Leyva","Estado":" No se puede implementar si no se solucionan los problemas mencionados.","text":"M\u00f3dulo:Administraci\u00f3n de personal;Categor\u00eda: RRHH;Pregunta\u00bfC\u00f3mo puedo solicitar d\u00edas de permiso?; Respuesta : Ingresa a iGrow y en la secci\u00f3n de Actualizaciones Organizativas dar click en la imagen de Solicita Vacaciones y Tiempo Libre. Crear Nueva Solicitud . Esta solicitud requiere aprobacion de tu jefe inmediato en sistema. Pulsa sobre el siguiente link para acceder a iGrow.; Sistema relacionado: iGrow; Link: https:\/\/performancemanager5.successfactors.eu\/login?company=casacuervo#\/login; Responsable:Azucena Tello Leyva; Estado: No se puede implementar si no se solucionan los problemas mencionados.","n_tokens":209},{"index":230,"Categor\u00eda":"RRHH","M\u00f3dulo":"Administraci\u00f3n de personal","Pregunta padre - Espa\u00f1ol":"\u00bfComo puedo solicitar permiso de matrimonio?","Respuesta - Espa\u00f1ol":"Ingresa a iGrow y en la secci\u00f3n de Actualizaciones Organizativas dar click en la imagen de Solicita Vacaciones y Tiempo Libre. Crear Nueva Solicitud .Seleccionando el tipo de ausencia que requieras. Esta solicitud requiere aprobacion de tu jefe inmediato en sistema.\n\nPulsa sobre el siguiente link para acceder a iGrow.","Sistema relacionado":"iGrow","Link":"https:\/\/performancemanager5.successfactors.eu\/login?company=casacuervo#\/login","Responsable":"Azucena Tello Leyva","Estado":"\u00ba","text":"M\u00f3dulo:Administraci\u00f3n de personal;Categor\u00eda: RRHH;Pregunta\u00bfComo puedo solicitar permiso de matrimonio?; Respuesta : Ingresa a iGrow y en la secci\u00f3n de Actualizaciones Organizativas dar click en la imagen de Solicita Vacaciones y Tiempo Libre. Crear Nueva Solicitud .Seleccionando el tipo de ausencia que requieras. Esta solicitud requiere aprobacion de tu jefe inmediato en sistema. Pulsa sobre el siguiente link para acceder a iGrow.; Sistema relacionado: iGrow; Link: https:\/\/performancemanager5.successfactors.eu\/login?company=casacuervo#\/login; Responsable:Azucena Tello Leyva; Estado: \u00ba","n_tokens":206},{"index":340,"Categor\u00eda":"RRHH","M\u00f3dulo":"Administraci\u00f3n de personal","Pregunta padre - Espa\u00f1ol":"\u00bfTengo beneficios en base a antig\u00fcedad?","Respuesta - Espa\u00f1ol":"Debes tener contacto con el HRBP de tu localidad para tener mayor informacion y\/o debes levantar un ticket en Contacto RH para solicitar informacion.\nDesde la intranet de Cuervo accede a Ayuda e selecciona Contacto RH e ingresa con tu usuario y contrase\u00f1a de red y selecciona Recursos Humanos.\n\nPulsa sobre el siguiente link para acceder a la intranet.","Sistema relacionado":"ARANDA","Link":"https:\/\/jcintranet.cuervo.com.mx\/web\/intranet-cuervo","Responsable":"Azucena Tello Leyva","Estado":"\u00ba","text":"M\u00f3dulo:Administraci\u00f3n de personal;Categor\u00eda: RRHH;Pregunta\u00bfTengo beneficios en base a antig\u00fcedad?; Respuesta : Debes tener contacto con el HRBP de tu localidad para tener mayor informacion y\/o debes levantar un ticket en Contacto RH para solicitar informacion. Desde la intranet de Cuervo accede a Ayuda e selecciona Contacto RH e ingresa con tu usuario y contrase\u00f1a de red y selecciona Recursos Humanos. Pulsa sobre el siguiente link para acceder a la intranet.; Sistema relacionado: ARANDA; Link: https:\/\/jcintranet.cuervo.com.mx\/web\/intranet-cuervo; Responsable:Azucena Tello Leyva; Estado: \u00ba","n_tokens":205},{"index":370,"Categor\u00eda":"RRHH","M\u00f3dulo":"Administraci\u00f3n de personal","Pregunta padre - Espa\u00f1ol":"\u00bfC\u00f3mo puedo solicitar un cambio de domicilio?","Respuesta - Espa\u00f1ol":"Debes de enviar a Contacto RH tu solicitud e informar al HRBP de tu localidad. Debes enviar documento de Comprobante de Domicilio oficial: (agua, luz, telefono) con una antig\u00fcedad no mayor a 3 meses.\nDesde la intranet de Cuervo accede a Ayuda e selecciona Contacto RH e ingresa con tu usuario y contrase\u00f1a de red y selecciona Recursos Humanos.\n\nPulsa sobre el siguiente link para acceder a la intranet.","Sistema relacionado":"ARANDA","Link":"https:\/\/jcintranet.cuervo.com.mx\/web\/intranet-cuervo","Responsable":"Azucena Tello Leyva","Estado":"\u00ba","text":"M\u00f3dulo:Administraci\u00f3n de personal;Categor\u00eda: RRHH;Pregunta\u00bfC\u00f3mo puedo solicitar un cambio de domicilio?; Respuesta : Debes de enviar a Contacto RH tu solicitud e informar al HRBP de tu localidad. Debes enviar documento de Comprobante de Domicilio oficial: (agua, luz, telefono) con una antig\u00fcedad no mayor a 3 meses. Desde la intranet de Cuervo accede a Ayuda e selecciona Contacto RH e ingresa con tu usuario y contrase\u00f1a de red y selecciona Recursos Humanos. Pulsa sobre el siguiente link para acceder a la intranet.; Sistema relacionado: ARANDA; Link: https:\/\/jcintranet.cuervo.com.mx\/web\/intranet-cuervo; Responsable:Azucena Tello Leyva; Estado: \u00ba","n_tokens":239},{"index":670,"Categor\u00eda":"ACCESIBILIDAD","M\u00f3dulo":"Accesibilidad SAP","Pregunta padre - Espa\u00f1ol":"Necesito acceso para visualizar\/modificar una Sociedad (compa\u00f1\u00eda) de SAP","Respuesta - Espa\u00f1ol":"Para habilitar esta transacci\u00f3n entra al siguiente link con el usuario PORTALGRC y con la contrase\u00f1a Agrcportal2021+ y solicita el acceso. Te adjuntamos el manual del portal (Incidencias) para tu apoyo en el proceso.","Sistema relacionado":"Portal de solicitud de acceso","Link":"https:\/\/fiori-u.cuervo.com.mx:4311\/sap\/bc\/ui5_ui5\/ui2\/ushell\/shells\/abap\/FioriLaunchpad.html","Responsable":"Salvador Velasco","Estado":"No se puede implementar si no se solucionan los problemas mencionados.","text":"M\u00f3dulo:Accesibilidad SAP;Categor\u00eda: ACCESIBILIDAD;PreguntaNecesito acceso para visualizar\/modificar una Sociedad (compa\u00f1\u00eda) de SAP; Respuesta : Para habilitar esta transacci\u00f3n entra al siguiente link con el usuario PORTALGRC y con la contrase\u00f1a Agrcportal2021+ y solicita el acceso. Te adjuntamos el manual del portal (Incidencias) para tu apoyo en el proceso.; Sistema relacionado: Portal de solicitud de acceso; Link: https:\/\/fiori-u.cuervo.com.mx:4311\/sap\/bc\/ui5_ui5\/ui2\/ushell\/shells\/abap\/FioriLaunchpad.html; Responsable:Salvador Velasco; Estado: No se puede implementar si no se solucionan los problemas mencionados.","n_tokens":239},{"index":170,"Categor\u00eda":"RRHH","M\u00f3dulo":"Administraci\u00f3n de personal","Pregunta padre - Espa\u00f1ol":"\u00bfC\u00f3mo puedo solicitar mis vacaciones?","Respuesta - Espa\u00f1ol":"Ingresa a iGrow y en la secci\u00f3n de Actualizaciones Organizativas dar click en la imagen de Solicita Vacaciones y Tiempo Libre. Crear Nueva Solicitud . Esta solicitud requiere aprobacion de tu jefe inmediato en sistema.\n\nPulsa sobre el siguiente link para acceder a iGrow.","Sistema relacionado":"iGrow","Link":"https:\/\/performancemanager5.successfactors.eu\/login?company=casacuervo#\/login","Responsable":"Azucena Tello Leyva","Estado":"No se puede implementar si no se solucionan los problemas mencionados.","text":"M\u00f3dulo:Administraci\u00f3n de personal;Categor\u00eda: RRHH;Pregunta\u00bfC\u00f3mo puedo solicitar mis vacaciones?; Respuesta : Ingresa a iGrow y en la secci\u00f3n de Actualizaciones Organizativas dar click en la imagen de Solicita Vacaciones y Tiempo Libre. Crear Nueva Solicitud . Esta solicitud requiere aprobacion de tu jefe inmediato en sistema. Pulsa sobre el siguiente link para acceder a iGrow.; Sistema relacionado: iGrow; Link: https:\/\/performancemanager5.successfactors.eu\/login?company=casacuervo#\/login; Responsable:Azucena Tello Leyva; Estado: No se puede implementar si no se solucionan los problemas mencionados.","n_tokens":207},{"index":570,"Categor\u00eda":"ESTRATEGIAS DE LIBERACI\u00d3N","M\u00f3dulo":"Liberaci\u00f3n SAP","Pregunta padre - Espa\u00f1ol":"\u00bfC\u00f3mo puedo visualizar una solicitud de pago?","Respuesta - Espa\u00f1ol":"Para visualizar una Solicitud de Pago, Recuerda que debes de tener el n\u00famero de Solicitud de Pago a modificar. En caso de dudas de como hacerlo. Si tienes dudas te invito a ver el tutorial que hemos preparado para ti. ","Sistema relacionado":"\u00ba","Link":"\u00ba","Responsable":"Pedro Alejandro Avila","Estado":"Ok","text":"M\u00f3dulo:Liberaci\u00f3n SAP;Categor\u00eda: ESTRATEGIAS DE LIBERACI\u00d3N;Pregunta\u00bfC\u00f3mo puedo visualizar una solicitud de pago?; Respuesta : Para visualizar una Solicitud de Pago, Recuerda que debes de tener el n\u00famero de Solicitud de Pago a modificar. En caso de dudas de como hacerlo. Si tienes dudas te invito a ver el tutorial que hemos preparado para ti. ; Sistema relacionado: \u00ba; Link: \u00ba; Responsable:Pedro Alejandro Avila; Estado: Ok","n_tokens":162},{"index":400,"Categor\u00eda":"RRHH","M\u00f3dulo":"Administraci\u00f3n de personal","Pregunta padre - Espa\u00f1ol":"\u00bfQu\u00e9 productos de retribuci\u00f3n flexible tengo disponibles?","Respuesta - Espa\u00f1ol":"Debes levantar un ticket en Contacto RH para solicitar informacion.\nDesde la intranet de Cuervo accede a Ayuda e selecciona Contacto RH e ingresa con tu usuario y contrase\u00f1a de red y selecciona Recursos Humanos.\n\nPulsa sobre el siguiente link para acceder a la intranet.","Sistema relacionado":"ARANDA","Link":"https:\/\/jcintranet.cuervo.com.mx\/web\/intranet-cuervo","Responsable":"Azucena Tello Leyva","Estado":"\u00ba","text":"M\u00f3dulo:Administraci\u00f3n de personal;Categor\u00eda: RRHH;Pregunta\u00bfQu\u00e9 productos de retribuci\u00f3n flexible tengo disponibles?; Respuesta : Debes levantar un ticket en Contacto RH para solicitar informacion. Desde la intranet de Cuervo accede a Ayuda e selecciona Contacto RH e ingresa con tu usuario y contrase\u00f1a de red y selecciona Recursos Humanos. Pulsa sobre el siguiente link para acceder a la intranet.; Sistema relacionado: ARANDA; Link: https:\/\/jcintranet.cuervo.com.mx\/web\/intranet-cuervo; Responsable:Azucena Tello Leyva; Estado: \u00ba","n_tokens":185},{"index":690,"Categor\u00eda":"ACCESIBILIDAD","M\u00f3dulo":"Accesibilidad SAP","Pregunta padre - Espa\u00f1ol":"Necesito acceso para visualizar \/ modificar una Planta de SAP","Respuesta - Espa\u00f1ol":"Para habilitar esta transacci\u00f3n entra al siguiente link  con el usuario PORTALGRC y con la contrase\u00f1a Agrcportal2021+ y solicita el acceso. Te adjuntamos el manual del portal (Incidencias) para tu apoyo en el proceso.","Sistema relacionado":"Portal de solicitud de acceso","Link":"https:\/\/fiori-u.cuervo.com.mx:4311\/sap\/bc\/ui5_ui5\/ui2\/ushell\/shells\/abap\/FioriLaunchpad.html","Responsable":"Salvador Velasco","Estado":"No se puede implementar si no se solucionan los problemas mencionados.","text":"M\u00f3dulo:Accesibilidad SAP;Categor\u00eda: ACCESIBILIDAD;PreguntaNecesito acceso para visualizar \/ modificar una Planta de SAP; Respuesta : Para habilitar esta transacci\u00f3n entra al siguiente link con el usuario PORTALGRC y con la contrase\u00f1a Agrcportal2021+ y solicita el acceso. Te adjuntamos el manual del portal (Incidencias) para tu apoyo en el proceso.; Sistema relacionado: Portal de solicitud de acceso; Link: https:\/\/fiori-u.cuervo.com.mx:4311\/sap\/bc\/ui5_ui5\/ui2\/ushell\/shells\/abap\/FioriLaunchpad.html; Responsable:Salvador Velasco; Estado: No se puede implementar si no se solucionan los problemas mencionados.","n_tokens":232},{"index":680,"Categor\u00eda":"ACCESIBILIDAD","M\u00f3dulo":"Accesibilidad SAP","Pregunta padre - Espa\u00f1ol":"Necesito acceso para visualizar \/ modificar una Planta de SAP","Respuesta - Espa\u00f1ol":"Para habilitar esta transacci\u00f3n entra al siguiente link con el usuario PORTALGRC y con la contrase\u00f1a Agrcportal2021+ y solicita el acceso. Te adjuntamos el manual del portal (Incidencias) para tu apoyo en el proceso.","Sistema relacionado":"Portal de solicitud de acceso","Link":"https:\/\/fiori-u.cuervo.com.mx:4311\/sap\/bc\/ui5_ui5\/ui2\/ushell\/shells\/abap\/FioriLaunchpad.html","Responsable":"Salvador Velasco","Estado":"No se puede implementar si no se solucionan los problemas mencionados.","text":"M\u00f3dulo:Accesibilidad SAP;Categor\u00eda: ACCESIBILIDAD;PreguntaNecesito acceso para visualizar \/ modificar una Planta de SAP; Respuesta : Para habilitar esta transacci\u00f3n entra al siguiente link con el usuario PORTALGRC y con la contrase\u00f1a Agrcportal2021+ y solicita el acceso. Te adjuntamos el manual del portal (Incidencias) para tu apoyo en el proceso.; Sistema relacionado: Portal de solicitud de acceso; Link: https:\/\/fiori-u.cuervo.com.mx:4311\/sap\/bc\/ui5_ui5\/ui2\/ushell\/shells\/abap\/FioriLaunchpad.html; Responsable:Salvador Velasco; Estado: No se puede implementar si no se solucionan los problemas mencionados.","n_tokens":232},{"index":250,"Categor\u00eda":"RRHH","M\u00f3dulo":"Administraci\u00f3n de personal","Pregunta padre - Espa\u00f1ol":"\u00bfApartir de cuando puedo tomar la incapacidad por maternidad?","Respuesta - Espa\u00f1ol":"Tendr\u00e1 que presentarse cualquier d\u00eda de la semana 34 de gestaci\u00f3n con su m\u00e9dico familiar del IMSS para certificar el embarazo y, si lo amerita, les expida el certificado de incapacidad correspondiente.","Sistema relacionado":"#\u00a1REF!","Link":"\u00ba","Responsable":"Azucena Tello Leyva","Estado":"\u00ba","text":"M\u00f3dulo:Administraci\u00f3n de personal;Categor\u00eda: RRHH;Pregunta\u00bfApartir de cuando puedo tomar la incapacidad por maternidad?; Respuesta : Tendr\u00e1 que presentarse cualquier d\u00eda de la semana 34 de gestaci\u00f3n con su m\u00e9dico familiar del IMSS para certificar el embarazo y, si lo amerita, les expida el certificado de incapacidad correspondiente.; Sistema relacionado: #\u00a1REF!; Link: \u00ba; Responsable:Azucena Tello Leyva; Estado: \u00ba","n_tokens":140},{"index":460,"Categor\u00eda":"RRHH","M\u00f3dulo":"Reclutamiento y selecci\u00f3n","Pregunta padre - Espa\u00f1ol":"\u00bfC\u00f3mo puedo ver las candidaturas internas?","Respuesta - Espa\u00f1ol":"Ingresa a iGrow y da clic en Sitio de Carrera para poder consultar las vacantes disponibles.\n\nPulsa sobre el siguiente link para acceder a iGrow.","Sistema relacionado":"iGrow","Link":"https:\/\/performancemanager5.successfactors.eu\/login?company=casacuervo#\/login","Responsable":"Azucena Tello Leyva","Estado":"\u00ba","text":"M\u00f3dulo:Reclutamiento y selecci\u00f3n;Categor\u00eda: RRHH;Pregunta\u00bfC\u00f3mo puedo ver las candidaturas internas?; Respuesta : Ingresa a iGrow y da clic en Sitio de Carrera para poder consultar las vacantes disponibles. Pulsa sobre el siguiente link para acceder a iGrow.; Sistema relacionado: iGrow; Link: https:\/\/performancemanager5.successfactors.eu\/login?company=casacuervo#\/login; Responsable:Azucena Tello Leyva; Estado: \u00ba","n_tokens":149},{"index":240,"Categor\u00eda":"RRHH","M\u00f3dulo":"Administraci\u00f3n de personal","Pregunta padre - Espa\u00f1ol":"\u00bfCu\u00e1ntos d\u00edas de permiso \/incapacidad  me pertenecen por maternidad?","Respuesta - Espa\u00f1ol":"El IMSS otorga un certificado unico de incapacidad por un periodo de 84 d\u00edas. Mismo que debes de entregar a tu RH de la Localidad.","Sistema relacionado":"#\u00a1REF!","Link":"\u00ba","Responsable":"Azucena Tello Leyva","Estado":"\u00ba","text":"M\u00f3dulo:Administraci\u00f3n de personal;Categor\u00eda: RRHH;Pregunta\u00bfCu\u00e1ntos d\u00edas de permiso \/incapacidad me pertenecen por maternidad?; Respuesta : El IMSS otorga un certificado unico de incapacidad por un periodo de 84 d\u00edas. Mismo que debes de entregar a tu RH de la Localidad.; Sistema relacionado: #\u00a1REF!; Link: \u00ba; Responsable:Azucena Tello Leyva; Estado: \u00ba","n_tokens":129},{"index":560,"Categor\u00eda":"ESTRATEGIAS DE LIBERACI\u00d3N","M\u00f3dulo":"Liberaci\u00f3n SAP","Pregunta padre - Espa\u00f1ol":"\u00bfC\u00f3mo puedo modificar una solicitud de pago?","Respuesta - Espa\u00f1ol":"Para modificar una Solicitud de Pago, Recuerda que debes de tener el n\u00famero de Solicitud de Pago a modificar. En caso de dudas de como hacerlo. Si tienes dudas te invito a ver el tutorial que hemos preparado para ti. ","Sistema relacionado":"\u00ba","Link":"\u00ba","Responsable":"Pedro Alejandro Avila","Estado":"Ok","text":"M\u00f3dulo:Liberaci\u00f3n SAP;Categor\u00eda: ESTRATEGIAS DE LIBERACI\u00d3N;Pregunta\u00bfC\u00f3mo puedo modificar una solicitud de pago?; Respuesta : Para modificar una Solicitud de Pago, Recuerda que debes de tener el n\u00famero de Solicitud de Pago a modificar. En caso de dudas de como hacerlo. Si tienes dudas te invito a ver el tutorial que hemos preparado para ti. ; Sistema relacionado: \u00ba; Link: \u00ba; Responsable:Pedro Alejandro Avila; Estado: Ok","n_tokens":162},{"index":620,"Categor\u00eda":"ACCESIBILIDAD","M\u00f3dulo":"Accesibilidad SAP","Pregunta padre - Espa\u00f1ol":"Necesito acceso a una transacci\u00f3n de SAP","Respuesta - Espa\u00f1ol":"a) Si necesitas acceso a una transacci\u00f3n, accede al siguiente link \"\"\"\" con el usuario PORTALGRC y con la contrase\u00f1a Agrcportal2021+ y solicita el acceso a trav\u00e9s de la secci\u00f3n TX Adicional \/Vacaciones e\u2026. Te adjuntamos el manual del portal para tu apoyo en el proceso (Vacaciones Incapacidad \/ Transacci\u00f3n Adicional).\n\nb) Si necesitas acceso temporal para sustituir a un compa\u00f1ero por incapacidad o vacaciones, accede al siguiente link \"\"\"\"  con el usuario PORTALGRC y con la contrase\u00f1a Agrcportal2021+ y solicita el acceso en la secci\u00f3n de TX Adicional \/Vacaciones e\u2026 . (Vacaciones Incapacidad \/ Transacci\u00f3n Adicional).\n\nc) Si no cuentas con autorizaci\u00f3n a una transacci\u00f3n, accede al siguiente link \"\"\"\"  con el usuario PORTALGRC y con la contrase\u00f1a Agrcportal2021+ y solicita el acceso a trav\u00e9s de TX Adicional \/Vacaciones e\u2026. Te adjuntamos el manual del portal para tu apoyo en el proceso (Vacaciones Incapacidad \/ Transacci\u00f3n Adicional).","Sistema relacionado":"Portal de solicitud de acceso","Link":"https:\/\/fiori-u.cuervo.com.mx:4311\/sap\/bc\/ui5_ui5\/ui2\/ushell\/shells\/abap\/FioriLaunchpad.html","Responsable":"Salvador Velasco","Estado":"No se puede implementar si no se solucionan los problemas mencionados.","text":"M\u00f3dulo:Accesibilidad SAP;Categor\u00eda: ACCESIBILIDAD;PreguntaNecesito acceso a una transacci\u00f3n de SAP; Respuesta : a) Si necesitas acceso a una transacci\u00f3n, accede al siguiente link \"\"\"\" con el usuario PORTALGRC y con la contrase\u00f1a Agrcportal2021+ y solicita el acceso a trav\u00e9s de la secci\u00f3n TX Adicional \/Vacaciones e\u2026. Te adjuntamos el manual del portal para tu apoyo en el proceso (Vacaciones Incapacidad \/ Transacci\u00f3n Adicional). b) Si necesitas acceso temporal para sustituir a un compa\u00f1ero por incapacidad o vacaciones, accede al siguiente link \"\"\"\" con el usuario PORTALGRC y con la contrase\u00f1a Agrcportal2021+ y solicita el acceso en la secci\u00f3n de TX Adicional \/Vacaciones e\u2026 . (Vacaciones Incapacidad \/ Transacci\u00f3n Adicional). c) Si no cuentas con autorizaci\u00f3n a una transacci\u00f3n, accede al siguiente link \"\"\"\" con el usuario PORTALGRC y con la contrase\u00f1a Agrcportal2021+ y solicita el acceso a trav\u00e9s de TX Adicional \/Vacaciones e\u2026. Te adjuntamos el manual del portal para tu apoyo en el proceso (Vacaciones Incapacidad \/ Transacci\u00f3n Adicional).; Sistema relacionado: Portal de solicitud de acceso; Link: https:\/\/fiori-u.cuervo.com.mx:4311\/sap\/bc\/ui5_ui5\/ui2\/ushell\/shells\/abap\/FioriLaunchpad.html; Responsable:Salvador Velasco; Estado: No se puede implementar si no se solucionan los problemas mencionados.","n_tokens":480},{"index":100,"Categor\u00eda":"RRHH","M\u00f3dulo":"PM&GM","Pregunta padre - Espa\u00f1ol":"\u00bfC\u00f3mo puedo consultar mis objetivos a evaluar?","Respuesta - Espa\u00f1ol":"Para consultar tus objetivos, puedes ingresar en la opci\u00f3n de \"Desempe\u00f1o\" en iGrow y seleccionar la evaluaci\u00f3n del a\u00f1o correspondiente. Ah\u00ed se podr\u00e1n visualizar todos los objetivos que se hayan cargado durante el periodo de \"definici\u00f3n de objetivos\". Recuerda seleccionar el formulario correspondiente al a\u00f1o que deseas consultar.\n\nPulsa sobre el siguiente link para acceder a iGrow.","Sistema relacionado":"iGrow","Link":"https:\/\/performancemanager5.successfactors.eu\/login?company=casacuervo#\/login","Responsable":"Azucena Tello Leyva","Estado":"Se puede implementar, pero se recomienda mejorar la respuesta en base a los comentarios.","text":"M\u00f3dulo:PM&GM;Categor\u00eda: RRHH;Pregunta\u00bfC\u00f3mo puedo consultar mis objetivos a evaluar?; Respuesta : Para consultar tus objetivos, puedes ingresar en la opci\u00f3n de \"Desempe\u00f1o\" en iGrow y seleccionar la evaluaci\u00f3n del a\u00f1o correspondiente. Ah\u00ed se podr\u00e1n visualizar todos los objetivos que se hayan cargado durante el periodo de \"definici\u00f3n de objetivos\". Recuerda seleccionar el formulario correspondiente al a\u00f1o que deseas consultar. Pulsa sobre el siguiente link para acceder a iGrow.; Sistema relacionado: iGrow; Link: https:\/\/performancemanager5.successfactors.eu\/login?company=casacuervo#\/login; Responsable:Azucena Tello Leyva; Estado: Se puede implementar, pero se recomienda mejorar la respuesta en base a los comentarios.","n_tokens":259},{"index":510,"Categor\u00eda":"ESTRATEGIAS DE LIBERACI\u00d3N","M\u00f3dulo":"Liberaci\u00f3n SAP","Pregunta padre - Espa\u00f1ol":"\u00bfQu\u00e9 liberadores tiene mi grupo de compras?","Respuesta - Espa\u00f1ol":"Puedes entrar a la transacci\u00f3n ZMMR120.\nAgregar el grupo de Liberac\u00edon: \nAG-Release PR AG\nJC-Release PR Cuervo\nOP-Operation Release SP\nPA-Release PR PAU\nUS-Release P.Orders USA\nZ1-ReleaseStrategicProx\nZ2-Liberaci\u00f3n ABA0\nZ4-Liberaci\u00f3n OBD\nZA-Agric. Release SP\nZC-Liberaci\u00f3nes Coorporativo\nZD-Payment Request DEU\nZE-Liberaci\u00f3n ICON\nZI-Release PO JCMD\nZJ-Liberaciones JB\nZO-Release PR Operation\nZP-Release PO PUK\nSeleccionar si es para una Requisicion de compra o Solicitud de pago en el campo Objeto de Liberaci\u00f3n.\nSAP ECC","Sistema relacionado":"\u00ba","Link":"\u00ba","Responsable":"Pedro Alejandro Avila","Estado":"Ok","text":"M\u00f3dulo:Liberaci\u00f3n SAP;Categor\u00eda: ESTRATEGIAS DE LIBERACI\u00d3N;Pregunta\u00bfQu\u00e9 liberadores tiene mi grupo de compras?; Respuesta : Puedes entrar a la transacci\u00f3n ZMMR120. Agregar el grupo de Liberac\u00edon: AG-Release PR AG JC-Release PR Cuervo OP-Operation Release SP PA-Release PR PAU US-Release P.Orders USA Z1-ReleaseStrategicProx Z2-Liberaci\u00f3n ABA0 Z4-Liberaci\u00f3n OBD ZA-Agric. Release SP ZC-Liberaci\u00f3nes Coorporativo ZD-Payment Request DEU ZE-Liberaci\u00f3n ICON ZI-Release PO JCMD ZJ-Liberaciones JB ZO-Release PR Operation ZP-Release PO PUK Seleccionar si es para una Requisicion de compra o Solicitud de pago en el campo Objeto de Liberaci\u00f3n. SAP ECC; Sistema relacionado: \u00ba; Link: \u00ba; Responsable:Pedro Alejandro Avila; Estado: Ok","n_tokens":266},{"index":30,"Categor\u00eda":"RRHH","M\u00f3dulo":"PM&GM","Pregunta padre - Espa\u00f1ol":"\u00bfEn qu\u00e9 fecha comienza el proceso de evaluaci\u00f3n?","Respuesta - Espa\u00f1ol":"La evaluaci\u00f3n se lleva a cabo en el mes de diciembre y debe concluir antes del 31 de enero. Cada colaborador y jefe deben evaluar sus objetivos antes de esta fecha.","Sistema relacionado":"iGrow","Link":"\u00ba","Responsable":"Azucena Tello Leyva","Estado":"Ok","text":"M\u00f3dulo:PM&GM;Categor\u00eda: RRHH;Pregunta\u00bfEn qu\u00e9 fecha comienza el proceso de evaluaci\u00f3n?; Respuesta : La evaluaci\u00f3n se lleva a cabo en el mes de diciembre y debe concluir antes del 31 de enero. Cada colaborador y jefe deben evaluar sus objetivos antes de esta fecha.; Sistema relacionado: iGrow; Link: \u00ba; Responsable:Azucena Tello Leyva; Estado: Ok","n_tokens":136},{"index":630,"Categor\u00eda":"ACCESIBILIDAD","M\u00f3dulo":"Accesibilidad SAP","Pregunta padre - Espa\u00f1ol":"No tengo autorizaci\u00f3n para una transacci\u00f3n","Respuesta - Espa\u00f1ol":"Accede al siguiente link \"\"  con el usuario PORTALGRC y con la contrase\u00f1a Agrcportal2021+ y solicita el acceso a trav\u00e9s de TX Adicional \/Vacaciones e\u2026. Te adjuntamos el manual del portal para tu apoyo en el proceso (Vacaciones Incapacidad \/ Transacci\u00f3n Adicional)","Sistema relacionado":"Portal de solicitud de acceso","Link":"https:\/\/fiori-u.cuervo.com.mx:4311\/sap\/bc\/ui5_ui5\/ui2\/ushell\/shells\/abap\/FioriLaunchpad.html","Responsable":"Salvador Velasco","Estado":"No se puede implementar si no se solucionan los problemas mencionados.","text":"M\u00f3dulo:Accesibilidad SAP;Categor\u00eda: ACCESIBILIDAD;PreguntaNo tengo autorizaci\u00f3n para una transacci\u00f3n; Respuesta : Accede al siguiente link \"\" con el usuario PORTALGRC y con la contrase\u00f1a Agrcportal2021+ y solicita el acceso a trav\u00e9s de TX Adicional \/Vacaciones e\u2026. Te adjuntamos el manual del portal para tu apoyo en el proceso (Vacaciones Incapacidad \/ Transacci\u00f3n Adicional); Sistema relacionado: Portal de solicitud de acceso; Link: https:\/\/fiori-u.cuervo.com.mx:4311\/sap\/bc\/ui5_ui5\/ui2\/ushell\/shells\/abap\/FioriLaunchpad.html; Responsable:Salvador Velasco; Estado: No se puede implementar si no se solucionan los problemas mencionados.","n_tokens":241},{"index":520,"Categor\u00eda":"ESTRATEGIAS DE LIBERACI\u00d3N","M\u00f3dulo":"Liberaci\u00f3n SAP","Pregunta padre - Espa\u00f1ol":"\u00bfComo crear una estrategia de liberaci\u00f3n?","Respuesta - Espa\u00f1ol":"Para solicitar la creaci\u00f3n de una estrategia de liberaci\u00f3n es necesario contar con los siguiente: \na) VoBo del \u00e1rea de redise\u00f1o de proceso o Finanzas.  Se solicita al \u00e1rea de redise\u00f1o la matriz de aprobaci\u00f3n con los montos de cada uno de los aprobadores.\nb) Una vez que tenemos esto. Se deber\u00e1 de abrir un ticket al correo ITSUPPORT@cuervo.com adjuntando las matrices de aprobaci\u00f3n y el VoBo del \u00e1rea de Redise\u00f1\u00f3. ","Sistema relacionado":"\u00ba","Link":"\u00ba","Responsable":"Pedro Alejandro Avila","Estado":"Ok","text":"M\u00f3dulo:Liberaci\u00f3n SAP;Categor\u00eda: ESTRATEGIAS DE LIBERACI\u00d3N;Pregunta\u00bfComo crear una estrategia de liberaci\u00f3n?; Respuesta : Para solicitar la creaci\u00f3n de una estrategia de liberaci\u00f3n es necesario contar con los siguiente: a) VoBo del \u00e1rea de redise\u00f1o de proceso o Finanzas. Se solicita al \u00e1rea de redise\u00f1o la matriz de aprobaci\u00f3n con los montos de cada uno de los aprobadores. b) Una vez que tenemos esto. Se deber\u00e1 de abrir un ticket al correo ITSUPPORT@cuervo.com adjuntando las matrices de aprobaci\u00f3n y el VoBo del \u00e1rea de Redise\u00f1\u00f3. ; Sistema relacionado: \u00ba; Link: \u00ba; Responsable:Pedro Alejandro Avila; Estado: Ok","n_tokens":234},{"index":380,"Categor\u00eda":"RRHH","M\u00f3dulo":"Administraci\u00f3n de personal","Pregunta padre - Espa\u00f1ol":"\u00bfComo puedo agregar beneficiarios?","Respuesta - Espa\u00f1ol":"Debes tener contacto con el HRBP de tu localidad para tener mayor informacion y\/o debes levantar un ticket en Contacto RH para solicitar informacion.\nDesde la intranet de Cuervo accede a Ayuda e selecciona Contacto RH e ingresa con tu usuario y contrase\u00f1a de red y selecciona Recursos Humanos.\n\nPulsa sobre el siguiente link para acceder a la intranet.","Sistema relacionado":"ARANDA","Link":"https:\/\/jcintranet.cuervo.com.mx\/web\/intranet-cuervo","Responsable":"Azucena Tello Leyva","Estado":"\u00ba","text":"M\u00f3dulo:Administraci\u00f3n de personal;Categor\u00eda: RRHH;Pregunta\u00bfComo puedo agregar beneficiarios?; Respuesta : Debes tener contacto con el HRBP de tu localidad para tener mayor informacion y\/o debes levantar un ticket en Contacto RH para solicitar informacion. Desde la intranet de Cuervo accede a Ayuda e selecciona Contacto RH e ingresa con tu usuario y contrase\u00f1a de red y selecciona Recursos Humanos. Pulsa sobre el siguiente link para acceder a la intranet.; Sistema relacionado: ARANDA; Link: https:\/\/jcintranet.cuervo.com.mx\/web\/intranet-cuervo; Responsable:Azucena Tello Leyva; Estado: \u00ba","n_tokens":203},{"index":210,"Categor\u00eda":"RRHH","M\u00f3dulo":"Administraci\u00f3n de personal","Pregunta padre - Espa\u00f1ol":"\u00bfCu\u00e1ntos d\u00edas de permiso me pertenecen por el fallecimiento de un familiar?","Respuesta - Espa\u00f1ol":"En caso de que un familiar de primer grado fallezca la empresa te otorga 2 d\u00edas h\u00e1biles.Ingresa a iGrow y en la secci\u00f3n de Actualizaciones Organizativas dar click en la imagen de Solicita Vacaciones y Tiempo Libre. Crear Nueva Solicitud . Esta solicitud requiere aprobacion de tu jefe inmediato en sistema.\n\nPulsa sobre el siguiente link para acceder a iGrow.","Sistema relacionado":"iGrow","Link":"https:\/\/performancemanager5.successfactors.eu\/login?company=casacuervo#\/login","Responsable":"Azucena Tello Leyva","Estado":"Se puede implementar, pero se recomienda mejorar la respuesta en base a los comentarios.","text":"M\u00f3dulo:Administraci\u00f3n de personal;Categor\u00eda: RRHH;Pregunta\u00bfCu\u00e1ntos d\u00edas de permiso me pertenecen por el fallecimiento de un familiar?; Respuesta : En caso de que un familiar de primer grado fallezca la empresa te otorga 2 d\u00edas h\u00e1biles.Ingresa a iGrow y en la secci\u00f3n de Actualizaciones Organizativas dar click en la imagen de Solicita Vacaciones y Tiempo Libre. Crear Nueva Solicitud . Esta solicitud requiere aprobacion de tu jefe inmediato en sistema. Pulsa sobre el siguiente link para acceder a iGrow.; Sistema relacionado: iGrow; Link: https:\/\/performancemanager5.successfactors.eu\/login?company=casacuervo#\/login; Responsable:Azucena Tello Leyva; Estado: Se puede implementar, pero se recomienda mejorar la respuesta en base a los comentarios.","n_tokens":260},{"index":410,"Categor\u00eda":"RRHH","M\u00f3dulo":"Administraci\u00f3n de personal","Pregunta padre - Espa\u00f1ol":"\u00bfC\u00f3mo puedo solicitar un producto de retribuci\u00f3n flexible?","Respuesta - Espa\u00f1ol":"Debes levantar un ticket en Contacto RH para solicitar informacion.\nDesde la intranet de Cuervo accede a Ayuda e selecciona Contacto RH e ingresa con tu usuario y contrase\u00f1a de red y selecciona Recursos Humanos.\n\nPulsa sobre el siguiente link para acceder a la intranet.","Sistema relacionado":"ARANDA","Link":"https:\/\/jcintranet.cuervo.com.mx\/web\/intranet-cuervo","Responsable":"Azucena Tello Leyva","Estado":"\u00ba","text":"M\u00f3dulo:Administraci\u00f3n de personal;Categor\u00eda: RRHH;Pregunta\u00bfC\u00f3mo puedo solicitar un producto de retribuci\u00f3n flexible?; Respuesta : Debes levantar un ticket en Contacto RH para solicitar informacion. Desde la intranet de Cuervo accede a Ayuda e selecciona Contacto RH e ingresa con tu usuario y contrase\u00f1a de red y selecciona Recursos Humanos. Pulsa sobre el siguiente link para acceder a la intranet.; Sistema relacionado: ARANDA; Link: https:\/\/jcintranet.cuervo.com.mx\/web\/intranet-cuervo; Responsable:Azucena Tello Leyva; Estado: \u00ba","n_tokens":186},{"index":260,"Categor\u00eda":"RRHH","M\u00f3dulo":"Administraci\u00f3n de personal","Pregunta padre - Espa\u00f1ol":"\u00bfCu\u00e1ntos d\u00edas de permiso me pertenecen por paternidad?","Respuesta - Espa\u00f1ol":"5 d\u00edas h\u00e1biles a los empleados hombres, en caso de nacimiento de un hijo (a)","Sistema relacionado":"#\u00a1REF!","Link":"\u00ba","Responsable":"Azucena Tello Leyva","Estado":"\u00ba","text":"M\u00f3dulo:Administraci\u00f3n de personal;Categor\u00eda: RRHH;Pregunta\u00bfCu\u00e1ntos d\u00edas de permiso me pertenecen por paternidad?; Respuesta : 5 d\u00edas h\u00e1biles a los empleados hombres, en caso de nacimiento de un hijo (a); Sistema relacionado: #\u00a1REF!; Link: \u00ba; Responsable:Azucena Tello Leyva; Estado: \u00ba","n_tokens":116}]}